<?xml version="1.0" encoding="UTF-8"?>
<?xml-stylesheet href="https://moise-lang.github.io/xml/os.xsl" type="text/xsl" ?>

<organisational-specification
    id="cleaning_org"
    os-version="1.1"
    xmlns='http://moise.sourceforge.net/os'
    xmlns:xsi='http://www.w3.org/2001/XMLSchema-instance'
    xsi:schemaLocation='http://moise.sourceforge.net/os
                        https://moise-lang.github.io/xml/os.xsd' >

    <structural-specification>
        <role-definitions>
            <role id="cleaner" />
            <role id="supervisor" />
        </role-definitions>

        <group-specification id="team">
            <roles>
                <role id="cleaner" min="1" max="5" />
                <role id="supervisor" min="0" max="1" />
            </roles>
            <formation-constraints>
                <compatibility from="cleaner" to="supervisor" scope="intra-group" bi-dir="true"/>
            </formation-constraints>
        </group-specification>
    </structural-specification>

    <functional-specification>
        <scheme id="cleaning_scheme">
            <goal id="maintain_cleanliness">
                <plan operator="parallel">
                    <goal id="observe_environment">
                        <plan operator="sequence">
                            <goal id="locate_next_target" />
                            <goal id="move_to_target" />
                        </plan>
                    </goal>
                    <goal id="clean_room" />
                    <goal id="battery_loaded" />
                </plan>
            </goal>

            <mission id="cleaner_mission" min="1" max="5">
                <goal id="observe_environment" />
                <goal id="locate_next_target" />
                <goal id="move_to_target" />
                <goal id="clean_room" />
                <goal id="battery_loaded" />
            </mission>
        </scheme>
    </functional-specification>

    <normative-specification>
        <norm id="n1" type="obligation" role="cleaner" mission="cleaner_mission" />
    </normative-specification>

</organisational-specification>
